,tweet,sentiment
2888,سبحان الله آلحمد الله لا إله إلا الله ولآ حول ولآ قوه إلا الله الله أكبر استغفر الله اذكرالله غردبذكرالله,positive
2889,شاهرالمؤمنين عالم رياضي أردني انضم الي قائم أهم عالم رياضية عالمي نفتخر عالم مبروك أردن اردن,positive
2890,ما أعرف ان محمدرمضان عامل مسلسل في رمضان جاي اسم ابن حلال أمال مين لي يبئه ابن كلب,negative
2891,ضل برر معاير بيئي صارم استخدام فحم في مصنع اسمنت في آخر سمح استخدام فحم دون موافق بيئه أوقفوالفحم,negative
2892,كل هم إنقاذ وطن عدم اعاد نظام قديم عن طريق إطال طارئة و اطاله في فتره انتقاليه,neutral
2893,شارك علي تويتر يا شاب خلقجميل تعالى نشر علي هاشتاج ده خلق أحب رأى في مجتمع و تخلق ب,positive
2894,انتظر في تعليق علي مقال فهم هويدي حتي قارئ جزء ثاني الذي نشر يوم أسف ما طلب هويدي لا جرؤ اي انقلابي علي طلب,negative
2895,اللهم زد أحب عفو عافي توفيق سداد صلاح حفظ من كل سوء صباح خير,positive
2896,عا أمن وطن ساهر نحي عميد ماهر أنا يا,positive
2897,رصد وصول مرسي مقر أكاديمي شرط في قضي تخابر وصل آن رئيس محمد مرسي إلى مكان انعقاد محكم,
2898,انخضع إرهاب هذا ليس حل,negative
2899,أبو فتح في دويقه كان حكم عصاب لم رأى مثيل ل في تاريخ بواب شروق,negative
2900,أنا نشر توضيح فيديو تم إستغلال شكل واطي مش معني إن أمن مفتري أبقى كل لي بيقولوه أخ صح,neutral
2901,خامس مر في بيان إدان أو استنكار أو عزى صدر عن أخ يمن مات أو اختطف أو عذب من جند عامل أهل غيرالإخوانج,negative
2902,فوشياموفبنيدهبي كيلو دقيق أبيض تحت عين ياظلمه س,negative
2903,بطل شرقاوي أحمد الشحات جدد ذكر سليمان خاطر سعد إدريس حلاو أيمن حسن تحي روح شهيد نضال مقاوم مستمر ضد عدو صهيوني,neutral
2904,حاضر حنسكت و مش حنقربله نقد أو سخري عشان هو اغلبيهحاكون امع و أمشي مع رايجه حاضر,negative
2905,وجود يا شاب غيرة علي بلد علي اختلاف افكار يملؤني تفاؤل,
2906,بابا أزهر شيخ كنيسه دعامتان عصاب انقلاب ترزي فتاوي علي جمع حاضر دائم لعب علي غرب كذب حرق كنيسة اضطهاد قبطي,negative
2907,اعتصام عامل بلاتنيوم داخل ميناء سخنه حاميهاحرميها جيزه,negative
2908,قد لإ سيد قطب,neutral
2909,ذلك أن إذا ودع الله وحد كفر إن أشرك ب آمن حكم الله علي كبير غافر أحبكربي,positive
2910,كل كاتب ف ال ثانويهعامه ثانويهعامه بقي موض,negative
2911,ا,positive
2912,جالس عالم زاحم بركبتيك إن الله حي قلب نور حكم كما حي الله أرض ميته وابل من سماء مصطفيح,positive
2913,حزن أم كره,negative
2914,عند قضاء واقف هو محاماه قضاء جالس هو قضى عدل نائم جلالعامر,
2915,استغفر الله الذي لا إله إلا هو حي قيوم تاب إلى غردبذكرالله,positive
2916,إرهاب خس انحطاط حي مصر,neutral
2917,مصطفيحسني إلهي سيد نفس شكر علي أي حاج هتعملها قبل ما عمل إن متأكد إن مش هتعملي إلا كل خير أحبكربي,positive
2918,رابط اهو اخوه مشكك علي موقع جزيره مباشر أخ بق لا,neutral
2919,فرقة بين داعي ديوث شرشوحه خالة فرنسا أن خالة فرنسا تاب لم كان ل حظ عمل في تقديم برنامج ديني,negative
2920,لي قال تحرش نقص دين في أوروبا معظم نتس مش متدين ده نقص اخلاق و لي يقولك حرمان كتير من متحرش متجوزين,negative
2921,أداء مخزي بعض شخصية الذي كان سمى مستقل ثبت أن كل ما في أمر أن لم أخذ فرصة في نفاق مبارك أن كل كرسي كان محجوز,negative
2922,ذلك يوم ما كان انتقد اخوان قال مش وقت تغلطونا دلوقتينخلص من عسكر و بعد عمل لي انت عايزينه هي دنيا,negative
2923,علاءعبدالفتاح زعلان أن ميسيحين بيصقفو سيسي فكر ميسيحين بي ماسبيرو علاء شلتو دم هو تجارتهمالرابحه ل,negative
2924,أسواني رئيس لا ظن أن كذب يضركبالعكسالكذب اذ تكرر كثاف أدى الي تشويش ذهن ناس حتي مقال كامل,neutral
2925,تعليق صباح علي تسجيل حمدينصباحي شأن محكمة سيسي تحيامصر مصر اخوان باسمطلعحرامي حركهكايدينهم,neutral
2926,محمودسعد إعلامي قذر بعد اذاع فيديو خيان حمدين قال لم اسمع جيد لم علق على لان ليس إعلامي بل آفاق من,negative
2927,علي سبيل آآدمان قاتل ميرندآتفآح شيكولآآته شيبسي لو أحب حآآج في آآيك,
2928,رضى يارب كلمتينوبس,positive
2929,أسف يا ريسرغم إنتمائي أخ إلا أن إبن ثور حريه ذلك أرفض سلطة مطلق رئيس مهما كان سبب أي كان مد,negative
2930,عمل اعتقال مستمره رمز رفض انقلاب هدف رئيسي مساوم هذا علي حرية مقابل تنازل عن حري شعب لكن الله ثب,negative
2931,كام واحد هنا هم إن قاصد قال إن حيوان في زريب مش إن ده لسان حال لي بيقول إن حق إنسان سلعة غربي مرارطافح,negative
2932,أسوانيان جريمة الذي ارتكب اخوان مسلم تزايد كل يوم رغم من بشاعة هي كشف حقيق اخوان الذي,negative
2933,في ناس بتبعتلي رسالة عتاب رقيق جد الله يا جماع أنا ما عنديش أي ني كان كاهن لا مالك قول خروف يا خروف في شه مش هتغير,neutral
2934,اعتقد إن لو مقتنع كلام ده أبقى دي مشكل من نفس نوع لو أنتم مل أبقى روح إعمل عصيان مدني رين,negative
2935,أكد علي حق جماع أخ في احتفاظ ترخيص جمعي أهلي مزاول نشاط أهلي في نطاق قانون الذي سن برلمانهالا ل,positive
2936,رواية متضارب متناقض حول احداث طريق نصر حل تحقيق عادل مستقل شفاف استجلاء حقيقه لا وجب ان فلت من أجرم من عقاب مهما كان موقع,neutral
2937,لا لن وظف أبد عمل خير انتخاب أو سياسه دعا تبرع خير قبل رمضان استخدم تويتر فيسبوك سيل تواصل ليس مغازل مصر جديد,neutral
2938,براءه من قتل متظاهر كان أبريل علشان معلومة أبقى صح عنى في عقر حكم أخ لم استأنف قبل ال يوم,neutral
2939,يوم اسم على جميع,
2940,لو كان أمن هيحل فشل سياسه كان حل فشل مبارك فشل طنطاوي فشل سياسه لا أحل إلا سياس ناجح ذكي غير كد نزيف دم إن كان عقل,neutral
2941,كائن بوليس اسم لواء حمدي بخيت علاقة انسانيه كرامه زي علاقة رب اتن مقطوع,negative
2942,بدء محاكمهمرسي و متهم في اقتحام سجن عصام عريان طلب عمل جراحي,
2943,فرقة بين شجاع طالب ثانوي محل جبن مسؤول تعليم نذال اخوان هو ذات فرقة بين مستقبل مصر ماضي مستقبل قادم انتصر حتم,neutral
2944,مناخ معانا تواصل رغم محاولة,negative
2945,اح كد مش بنتشطر غير علي بعض مصر,negative
2946,شعب هو بطل وحيد,positive
2947,أوقفوالفحم,negative
2948,ساعد أي حد عاوز خير غير خير هيعرضلك كل خير إللي ممكن عمل و يوصلك كل مبادرة و جمعية مب,positive
2949,تقرير جزيره بين وضع قضاء شامخ الذي حدث عن عدل منصور الذي عين سيسي مصر حكمالعسكر,
2950,وفد ذو تايمز جيش جمهوري أيرلندي طبق تكتيك قاعده ذكر صحيف ذو تايمز بريطا وفد,
2951,هل فرح حرام كان خطأ أول زميل إنقاذ إعلام هو امتناع عن مساهمه في إنقاذ تحرير جندي من,negative
2952,ياريت بس أخ وحد كذب هو مرسي جامد قوي أحبط مؤامرة شرس لا مغلوب علي أمر دولة كل ضدهكدب مساوي لا صدق مجعرف يا إخو,neutral
2953,يا ل من عالم مزري تويتبخطك,
2954,د علاء أسواني متى تحول مواطن في دولة ديمقراطيه الذي كفل حق كامل الي مجرم وجب محاكمة عقاب,neutral
2955,تب ل يا مارك أخير استطاع تغير إسم دعوة صديق كي تمكن من استرجاع إسم أول,negative
2956,كل كرر حزب نور افعال وضيعه كل تذكر فعل حقيره ممثل برلماني بلكيمي,negative
2957,برنامجيالمفضل أوسكار,positive
2958,مصر خسر روح ابن الذي لا عوض مال السعوديه أوالامارات,negative
2959,بنت لي بيقولو لفظ خارج دولة خصار في اتسم بنت أصل,negative
2960,حاجاتبتفرحفيمصر لمه حلوه مع اصحاب,positive
2961,جيل وسط هو الذي شغل أسئل مشكلة عصر باحث عن حقيقه,positive
2962,ما حدث مع معتصم تحمل مسؤلي مجلس عسكري أين دور رئيس وزير في ضوء صلاحية كامله ممنوحه ل,neutral
2963,جمعيهالاقلمنفولورز أدرك حظ لن نعم فولورز مر أخرى مجد كادح قد ولي زمن نخبة,negative
2964,حصري وطن فيديو ضابط أمن مركزي يسحل متظاهر كال ل سباب مصر,
2965,مليار انقلاب إعلام أميركي لن تحسن صورة دفع غريب من أجل عمل حرام دفع شعب الي جوع هوان,negative
2966,سلطة مطار أقصر تفحص طائر تجسس حوز راكب عائد من جد,
2967,بص يا سيد أنا ضد فض أي اعتصام قوه أعلن ده بعد حرس جمهوري أيض غلق محطة لكن هذا لن جعل أدعم طفاس قيادة فاشل,negative
2968,إمام مسجد سيد جابر طلع علي منبر و استقال و قال وقف عايزاني عافيه أوجه ناس تأيد قرار رئيس في خطبة,negative
2969,اخت عند تأخر زواج ذكر سيد خديج على سلام صبر أخذ أعظم رجل في عالم,
2970,إن ذكر رحمن ذهب حزن أحبكربي,positive
2971,أسواني دم سوف علق بيد كل من اشترك في هذا انتخاب باطل فلنقاطع انتخاب ننضم الي,negative
2972,دعبد منعم أبو فتح تعدديه اثراء تنوع أكثر فائد مجتمعالتعدديه مطلوبهوهي ليس انقسام فرق,neutral
2973,مبروك مبروك كل زميل اشكر كل من ساهم انجاح هذا إنجاز راقي يوم نقابهالصحفين,positive
2974,ثماني غارة طائرة ل نظام علي مدين دوم خمس عشر علي مليحه في غوطهالشرقيه سأل الله أن رد كيد في نحر أن,negative
2975,وحدة الذي أفسد بإخلافك مستمر وعد إعلان غير دستوري الذي قسم مصر قوة في وحدة رئيس,
2976,من كثر تحلطم لي سرى دم كويتي حتي إذا شافي سيار مكتوب على ما شاء الله لازم قال شدعوه عند فرار عاد,
2977,أبو إسماعيل أم امريكي لا مش امريكي طب فين جر كارد طب ده ماسك عي مستند و اخر فسسسسسس,neutral
2978,توفيقعكاشه محمدرمضان دا شمام سمكري بوابير جاز,negative
2979,ابراهيمعيسي ساخر هل وجد علاق واضح بين تاريخ سياسي و راقص عالم,negative
2980,كما أدخل مجلس عسكري نفس دائر شبهة إن لجنه قد وضع نفس هذا قرار في مرمي سهم لجنه مجلس وجه عمل واحد,negative
2981,هنأ كل طالب طالب قضى ما زاد عن يوم معتصم واجه كل أنواع تنكيل جامعهالنيل,positive
2982,تعطلالواتساب توقفالواتساب واتسابمعلق تأملو هكذا,
2983,حامي حرام,negative
2984,نفسكفيأيهفيالجنه نكلم رسول صلى الله على و سلم,positive
2985,قص شاب سعودي منصور حلق جديد من حلقة بسم أمل,
2986,ولي ولي عهد معلاة وزير وزارة عشناوشفنا,negative
2987,لن تقدم مصر طال بقي في بوق تدليس مثل هيكل طال بقي في أذن استمع ل عقل انبهر ب وبتخاريفه حكاية,negative
2988,طال إن مصدق إن داخليه كان غطى حماده مش عرى لا تسحل أنا كمان هاصدق إنكو بتبعتو ناس اغتصب بنت في تحرير قتل ناس في كل حت,negative
2989,سعاده ان كان من أحب خير عافي نحن شعر ب اهتم امر حتي لو لم رأى,
2990,أحد ضحية اخوان اصابوه رصاص في قدم ثم عذبوه بشاع داخل جامع هو أحمد ثابت عضو أبريل هو عالج الان في مستشفى بترول إسكندريه,negative
2991,لا انتصر نفس و لكن انتصر حق و تعلم من إمام شافعي حين قال ما ناظر أحد قط إلا تمنى أن جرى الله حق علي لسان,positive
2992,اكتبرسالهلشخصدونذكراسمه حياه ي صاحب أجمل من شاع حزن لا حزن ابتسم تفائل دائم كان علي يقين لن أصاب إلا,positive
2993,صبح ما بيجي بقي حاسس بإنتصارالليل أعدى علي أنا واقف في إنكسارأما ما بين في عزيم قرار ضاع علي خر نهار كراكيب وسطالبلد,neutral
2994,نائبالعام أحال برهامي استئناف قاهره في بلاغ اتهم ب ازدراءالأديان أحال مستشار هشام بركات,
2995,دعا دين نشر أكذوبة لم كان أبد عضو وطني أنتم تاجر دين,negative
2996,مسير احرار جدعان معادي الان حاميهاحراميها مرسيرئيسي مكمل,neutral
2997,منع سمالمصري من غناء مصر تحريض علي فجور السعوديه رياض دمام قصيم تبوك جد قطيف عواميه,
2998,دعوهالصائملاترد اللهم غفر ل ذنب أجل هم بدد وحشة أنر قلب ذكر طاعة جعل خير مفاتح درب صدق نور طريق,positive
2999,في مواجه نظام ملالي مجرم حل وحيد هو صمود نضال ضد غاصب حق سياد شعب عامل كادح عيدالعمال اي,negative
3000,أجمل ما راوند عين في معرضالكتاب,positive
3001,رصدعاجل نائب رئيس وزير تركي بولنت أرينتش معلق علي حكم إعدام في مصر قبل قليل نأمل أن لا وصل,
3002,تفو غزهتحتالقصف,negative
3003,مضمون كلم رئيس استعلاء علي مطلب شعبيه دفاع عن خطأ عوض عن تراجع عن تبرير عنف جماعة دعا حوار شكلي ل الله يا مصر,negative
3004,دراما رمضان مصريه كباريه كبير,negative
3005,و كائن هلامي معرض لي كان مقوم دنيا علي حكوم هشامقنديل و ساكت علي حكوم محلب رمز حزب وطني حراميهالدعم,negative
3006,عيدالأم أم هي عيد حياه,positive
3007,أخبارمصر اخبار مصر ضبط منشور و مولوتوف مخزن ملحق ب جمعيهالشرعيه ب ديرمواس مزيد من تفصيل,
3008,أنا ضد تمويل أجنبي تمام غريب ان انتسب بعض الي إسلام استغل فقر ناس اشترى اصوات ثم يتبار في بذاءه اي إسلام هذا,neutral
3009,أنا آن اعاني من اقسي أنواع طفش فكرهجميله يحطون غرفة نوم جامع اروح أخذ غفو بريك,neutral
3010,أطفال دولة لا مش أطفال ظظ يابتوع مدرسة هههههههههههههههههههههههههههههههههههههههههههه,negative
3011,عمر ما كان اتخيل ان هتحاور مع قتل أو متورط في قتليتبع,negative
3012,نسب بنت الي ما ارتبط مابتكلمش ولاد دا محنة صح صوت عمر مجدي كفاي محنة بقي,negative
3013,وطن زراعه ب أسيوط زياد في نسب توريد قمح,
3014,عارف عنى أي عداله وجه كثير عنى كلهماشي,negative
3015,تواجد مشرف من حزب حريه عداله حوزة كشف ناخب وجه ناخب نعمة ذلك مدرس خالد ابن,
3016,غياب عدل في وطني بشر انفجار غضب بركاني شعبي يسقطحكمالعسكر داخليهبلطجيه انتخبوالعرص,negative
3017,مصر رفع شعار رابع أثناء كلم اوباما ف ماليزيا مؤمن مؤمن بنيان مرصوص انتخبوالعرص,
3018,اتحاد طالب مدرسة ناشد نائب عام إفراج عن طالب مخترع,
3019,لا أمل في دولة دخل في حرب مع اعدائ تحرير أرض من تويتكأنكناشطايامحرباكتوبر,negative
3020,كل دستور ماضي سقط لان لم كان وفق أراد مجتمعي سادهالمحترمون,negative
3021,ميدانمفتي دم انقلابي صدق علي إعدام من تم احال اوراق إلى,negative
3022,مصدر مجموعة حدودي مسلح هدد أمن مصر قياد محمودعزت تفصيل,
3023,اذ عارض مرشد فان عند اخوان فل أو علماني عدو دين الا أمكن ان كان إنسان مسلم ثوري وطني معارض قرار مرشد ممكن,negative
3024,أبقى جد في كوكب قرد إذا إفتكر إن شعبية زاد ممارس تسويف قمع تدليس نفاق تبجيل تبرير ديكتاتوري فج,negative
3025,اللهم اغفر ميت ارحم عافي اعف عن أكرم نزل وسع مدخل اجمع ب في جنة دعاء دعائي غردبذكرالله ادعى يارب,positive
3026,لا استطاع ان جزم أحد مدى تعب حمار سوي حمار نفس ذلك رجا الا كان متأكد من كلام,negative
3027,نعمة احتاج شكر بلاء احتاج صبر ذنب احتاج إستغفار من شكر و صبر و استغفر نال سعاده,positive
3028,هل قرأ قرآن بعد رمضان هل فهم معنى فكر في هل نوى أن ختم قرآن بعد رمضان هل عرف ثواب قارئ تدبر,positive
3029,هل هذا هي ديمقراطيه هل وزع أيض مال علي طالب جامع نيل قيادة نقابيه زعزع استقرار هل أمن قمع تعامل مع احتجاج,negative
3030,وجب فصل حرك دعويه عن تنافس علي سلط سياسيه,neutral
3031,تلفزيون عرض ميدان خالي أغلق جيش ترك أربعون مليون لا غطى در شرف دين فين مظاهرة شعب اهو,negative
3032,تعرف ضابط لي قبض علي هيثممحمدين نزل لي فتش عشان ذو حي و شعر طوال و كتب كد ف محضر و اتكسفش علي دم,negative
3033,هل توافق علي تبكير انتخاب رئاسيه و إسراع نقل سلط من مجلس عسكري اشتراك في استفتاء يرجي,neutral
3034,عطوانهل شرب عباس حليب سبع يتحدي نتنياهو و أمريكا قلل كاتب فلسطيني عبد باري عطوان رئيس تحرير,
3035,ضبط من متردد علي اعتصام رابع حوزة بندقي آلي وترامادول,
3036,اعتراف خطأ خلقجميل,positive
3037,سعاده أنت ذات و فرح عين,positive
3038,يلتقيكم يوم د عمرو خالد و ممحمد مؤمن و دجيهان رمضان مع إعلامي معتز دمرداش و لقاء خاص عن حمل إحنا شعب,
3039,اختيار عمرو أكد عضو جن تحكيم مهرجان فينيسيا سينمائي,
3040,و زي ما أخ و سلف اعتبروني عدو إسلام كتير من إعلام لي وقف معايا حيقلبوا علي قريب جد فاشيه لا دين ل,negative
3041,حمل شعبيه مكافح أفوره,negative
3042,قال سياسه مهلك شكل عام بحر يابني خشن مش ريش نعام غوص في تلقي غرقان كل شايل غنايم خفيف لي عام صلاحجاهين,negative
3043,قنديل سيسي على تقديم برنامج انتخابي عدم تعالى علي جمهور أخبارمصر فجر,
3044,حل هوتوحيد مطلب إقال نائب عام تطهير قضاء شرط منع محاكمة عسكريه ثم انتخاب نقل سلط الي مدينة أقصى سرع,neutral
3045,هل سرب الذي تطيرخارجه قطر هوسرب صلاح دين ابن خطاب وعليوهل ل دحلان و خلفان أم مثاليهأجنحههل نبت زواحف ريش ياقوماحسان,neutral
3046,إعدام ل صغارالخنازير بديع مرشد اخوان منيا مصر سيسي,negative
3047,طريق وحيده لتعبرك امك يا أنو حكى عالواتس اب عشناوشفنا,negative
3048,من لم شاهد لقاء مصعب شاعر مع محمود سعد نموذج طهار ثورة الذي اتسخ قذار سياسه,neutral
3049,ده مش جيل زي ما هيكل كان فاكر ده جيل يناير رابع جيل عز كرامه صمود صورة أسود في زنزانه,positive
3050,من لايعرف أم إلا يوم في سن هو عاق ل من وصل هدى بر يوم لا معني ل عيدالأم عند عيد أم مناسب عا,neutral
3051,طب ما أغلى بنزين و كهرباء و غاز حيستعملوا فحم رض في توليد طاقه غلاءالمعسل,negative
3052,عزيز متطرف قبل أن استخدم تعبير أسد في وصف شيخ فكر قليل في مشعر سيد والد,negative
3053,اللهم انتقم من انتقم من كل من فرح دم مسلم الله وقف يوم قيام لنحاسبك اللهم حسر علي ابناء,negative
3054,عادي دكتور تجي متاخر ثلث ساعي بس مو عادي طالب تأخر دقايق عشناوشفنا,negative
3055,تخيل ان تتشاجر في شارع أنت ضرب خصم هو ضرب ثم ظهر شخص كي فرق بين لكن اكتشف ان أمسك مكن خصم من هذا ما حدث في مصر الان,negative
3056,خازوق إسبرطي,negative
3057,ممكن رئيس لس جايب من صوت في إعاده ضد فل على بلاغ ممكن فجأ لاقى من نفس شعب مؤيد ديكتاتوري,negative
3058,اعترف مطلب مشروع متعلق حكوم إنقاذ وطني تعديل دستور تقنين وضع جماع أخ إطار حوار أقر إلزامي نتيجة حوار,positive
3059,ثأر سيدبلال غير سيلاحققك أي أفاق برهامي شيوخالسلاطين تجاردين,negative
3060,لي يشوفك يتمني كان مثل لي عرف يحترمك أحب لي سمع عن يتمني يقابلك حاول,positive
3061,اعجبني رأيكوان رفض تعميم سلب اتفق مع ان موروث مصر حضاري هو ناهية مشروع وسط بناء على,neutral
3062,كل عام و أنتم خير أقبل الله من و من صالح عمل,positive
3063,ساريه أنشود حاشى يا رسول الله نشاما شبكهالمجد قناهماسه,
3064,ابراهيممحلب استقبل سيدالبدوي رئيس حزبالوفد جديد بدويالوفد دعم حكومه حاليه في خطوة الذي صب في صالح مواطن مصري,
3065,يالله فور أول ما استعاد سيطره علي دي إم اتفق كتير علي يوم أربعإنت احشني جد,positive
3066,قرار وزير ثقافه خالف قرار إتحاد دولي منتج والسينمائين في شأن عدم إسناد تنظيم مهرجان قاهره دكتور يوسف شريف رزق الله,negative
3067,حذار يا عدليمنصور ان أفرج عن دوم كما طلب من ممدوححمزه من وقع ع بيان من مهزأ الذي طلب تفريط في لا ملك لاتملك أنت,neutral
