,tweet,sentiment
0,هنأ دكتور أحمد جمال دين قيادي حزب مصر مناسب صدور أولى رواية,positive
1,برادعي استقوى امريكا مرهاخري و أرسل عصام عريان الي واشنطون شئ مقرف,negative
2,والد لو اقول خاطر حشيش ضحك بس من اقول ملل الله كيل أعطى محضر عن فسق فجور جنوب شيشان لي كذا يانبع حنان,neutral
3,انتخبوالعرص انتخبوالبرص مرسيرئيسي اينرئيسي,neutral
4,أمير عيد هو لي فعل يتقال على ستريكر صريح كاريوكي سكهشمال,positive
5,عود جماع أخ إلى حياه سياسيه نفس وضع سابق مستحيل طرمخه علي جريمة ماضي لن جعل تقدم شبر,negative
6,صداقه زرع حياه زهور ميزياده,positive
7,إصرار علي إستفتاء في ظل وطن ممزق غليان شعبي غياب أمني قضاء معطل علم محاصر هو انعدام إحساس مسؤول نحو مصر,negative
8,دضياء رشوان أن دكتور عبد منعم أبو فتح أكثر اعتدال سياسي دين كما أن اجتهد في مقصد شريعه,positive
9,أدان شد تقديم كل صاحب رأي أو ناشط سياسي محاكمة عسكريه علي مجلس عسكري التزام تعهد عدم إحال مدينة محاكمة عسكري,negative
10,مش هنسالك انت واقف جنب طلب قصاص كلب داخليه ضربو رصاص جيكا,neutral
11,عنف مدان ضد منشأة عام أو خاص ضد مجمع محكمة أو قسم شرط أو مقر إعلامي حزب أخ أون لاين من أجهزه أمنيه أو من متظاهر,negative
12,إلى زميل محامي راغب في انضمام لمبادرهسامعين صوتكالتي هدف دمج متحدي اعاقه في مجتمع أسعد اشتراك,positive
13,إآبني آلمستقبلي شرب حشيش عآإدي تصآإحب بنآإأإأت شغآل ضرب ابو مآالو بس طلع زملكاوي هولع في أب,neutral
14,هل هناك حضار دون وجود مرأه وجب أن وثق في قدرة مرأه هي دائم جزء من نجاح من غير مرأه لن كان هناك,positive
15,من كتاب ودع تعايش دكتور عمرو خالد إذا كان لدى دائرة فكري لدى دائرة فكر إذا ظلل علي بعد أبقى,
16,مؤتمر مفكر في أبو ظبي عالم عاش ثور علم تكنولويا تواصل إنساني نحن عاش حقب جهل كذب غياب قيمة حزين على يا مصر,
17,أنا لو نفس اخطط و ارتب و اصرف فلس دنيا عشان اشوه اخوان مش حاعرف اخترع حد زي صفا حجاز,negative
18,تحالف بين أنصاربيتالمقدس و حرسالثوري تنفيذ عملية إرهابي في مصر مصر أخ مدالشيعي عملياتإرهابيه,
19,أسمفيلمبتحبه أسف علي إزعاج,positive
20,مش عيب كذب عمر ما عمل لا هعمل بلوك حد لا مدح نفس,negative
21,ضعف انتخابي جماهيري لا اقتصر علي حزب جديد يطال كل تأكيد قوي راسخ في مشهد سياسي إلا أن عقد سلطوي مبارك طويل أنهك,negative
22,مصرالقويه حذر من خطر تحول سلطة دولة مجرد سند سلط عسكري لا فهم سياس لا وعى معني دولة مهمة حد خارج فكر حمل سلاح,negative
23,منذ عام حتي آن كل ما قدم أنصار تيار شعار إسلاميه مصر مجرد مشروع خناق مع عالم كون ابن وطن,negative
24,باسمطلعحرامي يا حرام,negative
25,دعمرو حمزاوي برنامج خر كلام أبريل,
26,سلفي سعيد عبد عظيم قال أن مرسي آي من آية الله نسي أن الله تعالى أرسل إلى مصر يوم سيد موسى آية من جراد قمل ضفدع دم,negative
27,لسان عربي بين ألسنه زمن ربيع بين أزمنه اليومالعالميللغهالعربيه,positive
28,بور ل في مولود دعا الله ان جمع شمل أسر في بيت طيب و جعل من خالد نعم إبن نعمة أبوان,positive
29,اكتبعبارهعليبابقلبك فراق وجه ضيق مواجه عيد وقت قاسي تقليد قشر,
30,أكثر شعور أوجع ما جاع في بيت مو بيت ايموشنموجب,negative
31,هاتلي اخوان أي حاج مش تنوين مش ضمير اخوان بعد كلم مش هتلاقي غير لوط شيطان,negative
32,عاوز كان عضو في حمل مشير سيسي سهل جد ساعد ان عمل مليون شير سأنتخبالسيسي,positive
33,ماظهلابد من معاير عداد توحيد تعريف كل قاطنينالتقديرات جزافيه ظلم بد أن توقف,negative
34,من سنة الذي فعل في وضع شهد وضع يد علي أخذ يمني علي يمني سرى علي سرى مبسوط إصبع مضموم نشرسيرته,
35,جمهوري مصر طبيعيه جمهوري ديموقراطي حقيقي جمهوري مدني حمى حق مواطن و مساواه و عدل,positive
36,كان أكره قارئ و حولني الي مهوس ب حول بيت الي معرضالكتاب ممتن ل جد استاذي,positive
37,ثورهالعراقيه هروب ضابط استخبار فوج خامس في جهاز مكافح إرهاب مقدم حسين محجوب عبد امير,
38,أسوانيماذا فعل أخ رداعلي سحل فتى تعرية قتل عشر من قبل عسكر الذي كان متحالف مع آنذاك,negative
39,حري تعبير لا تضمن تحريض علي عنف و فتن طائفي بل هو خطاب كراهي,negative
40,قصدي كان موجه كذب أن ما نتش هناك,negative
41,محب برنامج بيزيدوا,positive
42,مرسي فتح علي نفس فتح ضنك ذات رئاسيه دي ده في ناس هيبقي كيف شتيمه بعد كد,negative
43,لا أبد أنا مسرور من كلام,positive
44,عاجل تأجيل محاكمهمرسي و آخر في قضي حدث اتحاديه إلى جلس مايو مقبل سو,
45,قاهره حمل أمني إستهدف بؤرة إجراميه دائرة قسم شرط مصرالقديمه معادي دارالسلام كمي من,
46,حازمعبدالعظيم هو بيرد علي علي تويتر يوم حكم مرسي يقولي جيش دخل حل ليس حكم حازم دلوقتي في,
47,بكر قبل مايستقيل خد معا ميكروفون بيتبكري متن خد غرض من مجلس,negative
48,كامل احترام ل عباس لي مسك لسان ما شتمش,positive
49,يومالسابع أستاذ حق قاهره تشرف تدريس رئيس عدليمنصور,
50,خلقجميل قال حمد الله علي كل حاج أن رب مش عمل حاج وحش أبد,positive
51,سبع درس مستفاد خرج ب من حلق دردش تيوب الذي أذاع أحد ماضي عن اهتمام شاب عربي علي إنترنت,
52,سخري قدر ان اخوان ارهاب حينجحوا سيسي و دولة غباء حتنجح حمدين مصر أبريل,neutral
53,أبقى دائم سؤال ما إن جامد قوي مفترض إن معارض بيموتوا غيظ شاغل نفس بي لي ما بتستمتعش حلاو إنجازاتكالإجابهلأنك فاشل,negative
54,اكترى شيء أهم معرفة هل ده مشروع إستقلال حقيقي لا كارت مفاوضة في نفس توكيل,neutral
55,رصد خاص أولتراس جامع حلوان جاب جامع قبل بدء عالي مولد سيد سيسي,
56,ج أنعت رئيس بعد حشد مذهبي طائفي رئيس تكفير منتخب امتنع تشويه موقف تحويل عبث إلى أي شيء غير رفض مذهبيه تكفير,negative
57,ناس لازم أحس إن يونيو جت على فايد علي مستوي إقتصادي اجتماعيوسفالحسيني نقطهلقاء مص,positive
58,إصاب سيد في مشاجر بين شيخ بلد مساعد شرط أسلحه ناريه ب بنيسويف مصر تفصيل علي,
59,خافي نظام من ضيع عينهكمل تحقيق حلم فاعتقلوهخرج و كمل طريق قتل باسممحسن حكاي ثور,
60,د أبو فتح حكومه إسرائيلي تطيل أمبير صراع مع الفلسطينين أن لا أمكن استمرار و تماسك دون هذا,negative
61,النهارده في تحقيق استقصائي عبقري عن فساد في بورصه في مصريللأسف هيتوه في زحم حدث,positive
62,إستمرار حراك طلابي ب جامعهالمنصوره مفيشعساكريحكمونا,negative
63,أكبر معوق خازوق أخذ كان من أخ أنا شايف كد يوم وجب أن أكمل مشوار دون,negative
64,راجل بتاع أمن نفا معدل نفا كل دقايق فتح شباك عشان سقعه راح اشتكي مرار تكرار لي عم شعب معفن,negative
65,حظ عالم اهليالافريقي,negative
66,منهج انقلاب قتل قمع سجن اي معارض اعلام فاسد قضاء مسيس ارتفاع سعر اقتصاد انهار عزل دولي شحات خليجي,negative
67,كلب وفي رجاء عدم إهانة,positive
68,شريعه حكم كتب بعد وفى رسول ذلك غلط ربط شخص مش خوف لكن حرص علي أن معلومه كان صح,neutral
69,بنت تقلد مايكل جاكسون عل طريق مصريه مسخررره حطنيزكفيفيلم نيزك أعترا,
70,قتلي أكثر من مصاب في محافظة مختلف هذا مقدمة كارثي اقتتال أهلي حذر من دوم انبغى رفض مواجهة كل دم ا,negative
71,نفس في و تفو على فيفيعبده,negative
72,أعجب فيديو علي صاحبهالسعاده إبراهيمعيسي واقع,positive
73,الله بارى في حمدلله شدو رحل من لندن الي ليفربول كانو واثق خلف عظيم مورينهو صيعري صحاف اعلام,positive
74,لا ده بيقوللك سوري كمان أعلي حاج أن بيقوللك عبد بياده في نفس جمل بك جيش,negative
75,الذي انتخب شفيق ليس ضروره فل فل بساط هم كل من اشترك استفاد من فساد مبارك لا أمكن ثوره ان تحالف مع لان قام ضد,negative
76,مصر انقلاب طالب مقعد دائم دولة عربيه في مجلس أمن بين مصر عرب في أضعف حال مثل مريض طالب اتحاد,negative
77,كان حي طبق متوسطه أعلى في مصر و ذهب إلى كتاب و مثقف مصر بحث عن مزيج نادر اتفق مع طبيعة,positive
78,عامل مصر هم عماد وطن تكرار إعتداء علي عامل أكد ان دولة مبارك لم سقط وان تغير وجه,negative
79,مستشار قانوني محامي خبير في أنظمه محاماه محاما مستشار قانون زواج قضية محامي رياض قضي رقم ريتويت,
80,هات مقش معا بدأ فريق عمل معا صنع داي جديدهلمصر جديد مجموع من حملة نظافه في,
81,مناضل حمدينصباحي ظل ناضل ناضل حتي وجد نفس محكوم على إعدام أهم ممارس نضال في مكان عام بكر تشوف,positive
82,مقال د علاء أسواني هل كرر خطأ سنهوري نشر غد جريد مصري يوم,
83,أنصار حريه ديمقراطيه في أوروبا وضع شجاعه قبل اي شيئ آخر نادي إيطالي انتظر موقف انقلاب من عبد ظاهر,neutral
84,معظم اخواآن مشاركوش ف هشتاآج مسئ سيسي كد أبقى اخوان باعونا مرة مر ف محمدمحمود مر ف هشتاجهشتوج,negative
85,رب بارى في,positive
86,إستخدام مسجد في عمل سياسي نشر عنف,negative
87,اذ تم عفو عن مبارك نظام هذا رسال من شعب الي رئيس قادم تعالى اسرق استبد ب ذل كما كان مبارك,negative
88,شاهد جول سوري حر درع جول مع أمير إقتحام جبه نصر في تل جابيه بين جثة غنيمة علي,
89,صورة شهيده رضى رمضان سن الذي استشهد رصاص قوة أمن انقلاب فيوم انتخبوالعرص,
90,مهو ما واحد يصتبح علي جدول امتحان كد مفروض بقي يوم هيبقي عامل ازاي,negative
91,عمر شاف إستفتاء علي دستور أطاح مبدأ دستوريه مساواه تكافؤ فرصة في قاعدة مرحل إقتراع إدارة,negative
92,إيمان محق تهديد واصل نضال سلمي مع شعب مصري شاب ثائر استكمال ثورة قصاص دم شهيد وفاء روح شهيد محمدالجندي,positive
93,ذكر نبيل مصطفى نبيل كاتب كبير هو حي رزق نتمني أن تذكر باحث إعلام بعد موتهرحمه الله,positive
94,ألم أقل ل إن ممارس فاضح ازدواجي معاير تخوين معارض أمل أن لا ابتلع بعض قطاع رأي عام طعم مجدد,negative
95,ازاي برادعي قال ان هولوكوست مأسا انساني و ان بوذا ممكن كان نبي و ان سلف متطرف و طالب عود يهودايهده عصام عريان,negative
96,من آخر اي حد في رمق من معارض أمكن نزل انتخاب شعب أو شوري يتقبض على غاي ما تخلص خارط طريق بعد رب سهل,negative
97,الان علي قنا دريم ضيف برنامج توقيت قاهره مع حافظ ميرازي,
98,أسواني هذا لا وجد فرق بين إرهاب كنيسه كاثوليكيه في أندلس علي يد راهب بليد إرهاب أسام ابن لادن,negative
99,إعلامي محمد ود عقد مؤتمر جماهيري غد مدين زف حضور فنان غادهعبدالرازق دعم مرشح عبدالفتاحالسيسي إلعب ياسيسي,
100,من فهم في قانون أكثر من فقيه دستوري دكتور ثروت بدوي دكتور عاطف ب أستاذ جمال عيد كل أيد قرار رئيس عود برلمان,positive
101,انقلاب اعاد الي عام بعيد عن حرية ضائع تخلف زحف علي كل قطاع بكر تشوف مصر,negative
102,نبضرابعه شاهد معتقل منيا في قاع محكم هتف ساخر من قاضي و من فضيح زوجة مع مدرب كراتيه,negative
103,لم أدعم مرسي قاطع انتخاب اعتراض علي عدم عزل شفيق عدم محاكمة لكن مرسي فائز طبق تقرير قضى مستقل ثوره إخلاص حقيقه,neutral
104,زي نهار طفل ما انفلت من بين يد ضلمه يشقشق أنا شفت روح حق ما إتسللت صرخ في وش خرس إنطقعمار فؤاد حجاج,
105,نأمل أن لا وصل,
106,موقف اخوان من جو برلمانهمشلت بلطجي جنيهشريط ترمدولوجباتنتذكر سوا سادهالمحترمون,negative
107,لا أراد ان يجعلونا فعل مثل هم لا دين ل هم تاجر دين تحيامصر أنتخ,neutral
108,هل ممكن كان مرسي مختفي فتره دي عشان مش لاقي شاحن هو راخر آه يادوله عكاك,negative
109,عن فرح لمه خروج ضحكالسنين غني تصوير لفبالعربيه شارع صبح خبر عمرالمسخره انبساط يوم شيخ,positive
110,عبد ناصر عمل وحد مع سوريا بدأ ياميش سيسي هيعمل وحد مع اسرائيل بدأ طماطم,neutral
111,آخر ساعي يومالجمعه اللهم ان اسأل عيش سعيد موت شهيد فردوس اعلي بجن جنة عدن اللهم أمين,positive
112,سبحان يالله في ساعي مطر استجاب دعوة عادل,positive
113,دوري سيسي مرارطافح,negative
114,وزير غلابه باسمعوده معتقل ف سجن عسكر لان كل حلم هو تقديم افضلمنتجلاكرمشعب انامشرقم انتفاضهالسجون,neutral
115,قلم عقب أسبوع من محمد محمود مجد بطل محمد محمودهتفضل مصر شايل جميل دائم أبد,positive
116,كفاي اسفاف,negative
117,الليسريفودهمعملهمشريتويت دي فتن عشان انقسم عادى بعض إلعب غير,negative
118,اتفق مع في ان رجل عرف حق لا عرف حق رجل,positive
119,سيسي لام خطاب ديني غير مرتبط عصر علي ما لحق من ضرر قطاع سياحه في مصر مرسي اخوان السعوديه امارا,negative
120,حب لي أبقى ف نور قدام رب احلي كتر من كلام ف موبايل ليل وان تستخبي من اهلك,neutral
121,مين جاي مؤتمر بكره مؤتمر دفاع عن دستور استعرض مؤتمر آخر مستجد تطور عمل وضع دستور تبعة,
122,لا أهاجم مرسي أن أستكثر على رئاسه بل أن كذاب مخلف وعد في رقبة دم شبابلا أسمي خرفان حتي خروف استحيى أن دافع عن كذاب,negative
123,عاجبني إيجابيه خايبه بتاع رفقة طيب خليك إيجابي شوي حنك سياسي أي منظر مش ستريبتيز مجاني كد مرارطافح ثور,negative
124,نتمني رئيس وزير دكتور عصام شرف شفاء عاجل كما نتمني أن كان مرض مرض سياسي,neutral
125,و اعتز مصري و صعيد,positive
126,عاري عاري عاري عاري عاري عاري مانحن في عاري دم نهر شهيد عشر رصاص في رأس رقبه صدر,negative
127,د عمرو حمزاوي يوم ساعه مساء علي قنا يناير برنامج أهل بلد,
128,بلطجه أخ إعتداء علي إعلام محيط اكاديمي شرط سادهالمحترمون,negative
129,من ردد هم من لا أراد في مصر لا في سياسه لا في برلمان قادم كفى ضرر الذي أحدث ثقافة وعي سياسي لغة أسلوب,negative
130,بدء مؤتمر صحفي صحه إعلان عن إجراء مواجه كورونا مصر ميدانالتحرير,
131,بد من حمل إنتخابي علي أرض تواصل مع ناخب ناخب لا اعتمد فقط علي صحاف تلفزيون,neutral
132,إذا توقع إنتصار تشيلسي يوم ضد ليفربول ريتويت ليفربولتشيلسي,
133,أتمنى ان كان قوي إسلاميه ليبراليه يساريه راغب فعل في تشكيل قائم وطني موحد خوض انتخاب برلمانيه قادم,positive
134,أنا مش فاهم واحد عند اكتر من عشرون ألف متابع مجرد ان حاطط صورة و محور في اسم ريبورت و سبام من فضل,negative
135,فضيح تان أنا لس ماسك ف مستشفى راسي سدر عرف ان تم أخذ من دولة حد مليون جنيه لم تم صرف من,negative
136,اردوجان مستمر في نهج حاول أن لوث مد ثوري مصري يوسفالحسيني سادهال,negative
137,هنلف رجع نفس نقطهلما قال إن كل لي قال لا ثور مضاد أبقى ماتكلمنيش عن تفكير علمي منطقيبس كد,negative
138,حمدينصباحي قال برنامج هيتحقق في شهر بس مقالش هيبقي طبيعي و لا قيصري و في مستشفى أي رحم يا رب,negative
139,من أوقف قانون عزل من يجمد بلاغ فساد ضد شفيق من أهدر طعن تزوير هل جرى انتخاب اعاد نزيه اما تطبيق قانون أو مقطع شامل,negative
140,ما إن عارف مجموع شيوع إسم ابقي قدم في بلاغ ولاتنشر كلام علي عواهنهكلامك واضح يارجل حوار,negative
141,هل زال ظلم طاعة أو حنان ضعيف أين فارس قومي كي هب اصطفاف غزهتحتالقصف,neutral
142,إبراهيم صلاح ضحي ب مليون من هلال سعودي أو اتحاد جد إختار زمالك زملكاوي,positive
143,ب بعد عزل إجباري رئيس مدني منتخب كان أتمني أن لا حدث احترام أخ جوهر حقيقي ديمقراطيه متمثل في طلب شعب تغير,negative
144,شيخ حازم أبو إسماعيل رد علي فتوى برهامي أخيره فك الله اسرك يا بطل من تعلم منهج دين حق,positive
145,يا عزيز حاول أكثر من مر من سبتمبر لي فات كان موافق ثم اكلم من حول لا أجد اجاب شافيهدلوقتي برنامج خلص خلاص,neutral
146,حطنفسكمكانالبنت لي بقي سمع شتايم قذر من ناس اقذر في شارع عادي علي اساس ان ولاد كد تهزر,negative
147,في أمريكا دلوقتي محطة نويه شغال برنامج فضاء شغال بحث علميه استديوهات مصنع حزب حركة رفضإنت بقي شغال في إيه,negative
148,أطالب عزل شفيق محاكمة ثم عمل انتخاب نظيف أو تحقيق في تزوير استبعاد صوت باطل إعاده بين ثاني ثالث أو مقطع مهزله,negative
149,دعوهللتفاؤل ما أنزل الله من داء الا أنزل ل دواء,
150,مع ذلك سقط أمس إلى أبد مقول أن تيار ديمقراطيه لا شعبي ل أن أخ حليف احتكار اراده شعبيه توكيل صندوق,neutral
151,شمس حريه نادى يا وطني يا وطني غالي ولي خنو و انتخبوالعرص ريتويت,neutral
152,حوك,negative
153,من بواب هرم أسلوب حقير صهاينه استخدم من قبل مع آخر,negative
154,هذا ماقل يوم مع محمود سعد من أراد أن أدرك حقيق أكذوب إستقرار الذي روج لهتصبحوا علي خير,negative
155,برود اسلوبحياه,negative
156,أخ جماع إرهابي هم من قتل ابن,negative
157,يا فل يا لا مره تفويضكوم جابي لور مكمل مرسيرئيسي,neutral
158,نسمو علي خلاف سياسيه حزبيه نعل فقط مصلحه وطنيه انتصر ثورة كان مصر قوي إذن الله,positive
159,حين أصبح مصطفى بكر شبه متحدث اسم مجلس عسكري اعلم أن هناك كثير وجب عمل حتي نجح ثورة,negative
160,ان لون رمادي ليس ل محل من اعراب يا ابيض يا اسود علمتنيالثوره,negative
161,أثار تخريب كنيس مارجرجس حرق بيت قبطي قري دلج بعد اعتداء أخ سادهالمحترمون,negative
162,لا شيء برر إحال مدينة قضاء عسكري حتي بلطجيه قضاء مدني كفيل ب,negative
163,بواب شروق تأجيل لقاء بين صحه ولج إضرابالأطباء,
164,أهدم نفس عشان تبني مستقبل تعليمفيمصر,negative
165,يامن تحدث اسم إسلام ثم تلقي علي من يخالفك في راي صندوق قمام من بذاء كثير من اشتم أكثر اسلام من لان مهذب,neutral
166,مصرالقويه قد حذر في حزب مصر قويه لا زال حذر من خطور تحول سلطة دولة إلى مجرد سند سلط عسكري لا فهم الس,negative
167,مازال مشكله من داعي تحت اي رأي اجتمع و اسم تجمع و تيار ثالث و لا تيار شعبيو من قاد هل عقل,neutral
168,دولهالتعريص عسكر حرام,negative
169,لا استطاع رئيس مرسي ان تنصل من مسؤولية عن إلغاء عرض مسرحي علي مسرح دولة هل قرار أمن أقوى من رئيس وعد رئيس عن حري إبداع,negative
170,أما نسب شامخ فد يدلع قال يا أبو شامخ,negative
171,عمليه نسر لم فشل نسر هرب مع طائر نهضه عشان يتجوز عرفي و راجع,negative
172,دعلاء أسواني كيف أنصف إمام محمد عبده مرأه قرأ مقال كامل,
173,أسوانيلماذا أصر ولاية المتحده علي استمرار في دعم مرسي نهايه رغم قتل مصر قمع تظاهر,negative
174,أنصارالمعزول تعدي ضرب تعذيب علي صحفي جريد فيتو محمد ممتاز,negative
175,حياهاقتصاد استقال رئيس تنفيذي مجموع بيجي بريطاني بحرين إمارة كويت مصر سوريا جزاء,
176,تنظيم دولي أخ تعلم علي يد رامسفلد قام حرب في فت واحد أو كلاموكلام يوسفالحسيني,negative
177,قال أخ بيزايدوا علي توع إتحاديه طب و جمل مش هننزل نتظاهر مع أخ دي إيه رز لبن,negative
178,حاولماتبقاش والد لي صاحب ميه بنت في آخر هتجوز واحد استرجل بقي,negative
179,أهلي اسلوبحياه,positive
180,الله ينور على يا دكتور هو ده تفكير لي عايزينه مش كم مسجد كم كنيس,positive
