,tweet,sentiment
4360,يا كابتن إبراهيم كل لي بيقولك أحب معرفش أي دا عاوز ريتويت مش اكتر,negative
4361,عاجبني ساكس فون بيانو بس,positive
4362,لن أكتب في يوم شعر و لا نثر اكتفى أن وضع قلب علي ورقة,positive
4363,إن لي كاتب تقرير لي عن عم صبحي,neutral
4364,تفالو خيرررررر لقب ابن مصر إذن الله,positive
4365,لا أعطى قلب من لا قلب ل أن حتم سيخذلك لا أعطى حرف من لا قرأ أن لا شك أساء فهم,neutral
4366,مبحبش حد قرب حد حب,negative
4367,حتي شاب سرق في صورة بعض,negative
4368,صاحبتويتربيوزعفولورزنهايهالسنه عام لذيذ ع جميع,positive
4369,كان نايم معلش,neutral
4370,مفيش وقت ياريت صوت محمد علي رقم,neutral
4371,ال ده اختراع فوق رائع و الله,positive
4372,حمد الله مستنيه امتحان تيجي عشان اجازه بقي,positive
4373,عععععب يا زملكاوي عنتصدرانهاردهفلاتكلمني زمالك,positive
4374,كل واحد ادر كارثه لي ف حياة أنا ف كارثة هي ادر تتكتب كد عا,negative
4375,احي بقي ع حكم و ماتش,negative
4376,حكم مهزوز,negative
4377,حمدلله علي صحه عافيه الله أدام على,positive
4378,كان في اسئل جوايا لا ل جو لا رد,negative
4379,بسم الله رحمن رحيم توكل علي الله هشتاج ازاينساعدكيامصر,positive
4380,اه طبع يلا بقي من هنا بدل ما اغلط,negative
4381,مينا عطا مينافخرالعرب,positive
4382,هو جعفر مال رشيق كد لي,positive
4383,لا تحقرن صغير في مخاصم إن بعوضه تدمي مقل أسد متنبي,neutral
4384,عامل أعد فه سمع بتاع خمستاشرمره,positive
4385,وازي إبراهيم سكري وازي شوقي عنبري ريح عرق زي نيل,negative
4386,عذر نويتن ف رانا سماح سر جاذبيه رناسماحهفيإنتحر,positive
4387,هنفضل نحي طول عمر عشان انتي انسان قبل متكون فنان يا رانا سماح رناسماحهفيإنتحر,positive
4388,وبشهدلك قصاد ناس,positive
4389,جون كوستاريكا ده اتشقلب قدام,positive
4390,مليش مزاج,negative
4391,ماسبق من أسئل مفيد فوز عميقه يسر حدثحالا شلل حقوني,negative
4392,حكم ابن وسخ هيودينا ف دهي,negative
4393,مصدر حصاد قطاع مشروع صغير متوسطه خلال عام جاري قارئ تفصيل عبر رابط,neutral
4394,رمز فن راقي لدى قبول احساس صوت روع رناسماحهفيإنتحر,positive
4395,حكم أهلاوي معقول,negative
4396,جول يا ولاد وثخه حاكم معرص صحيح,negative
4397,عيال ام تكبر تتملي مساخ,negative
4398,مشكور ام عبدالله,positive
4399,قبل ماتتكلم علي جول بول انذار في أي,negative
4400,احلي أيام,positive
4401,قال كلم سرع في سر اهو أبقى اتقال و خلاص,neutral
4402,أحمد جمال في مع من شاذلي,neutral
4403,ما هو عشري أربى جوزيه بقي يلادوري,positive
4404,يابن لعيبه يا جو,positive
4405,أنا متفرجتش ع كيرم وماتفرجتش ع لا حلق من هاوي اي ميت يور ماذر لي خد من حي من أسابيع وماتفرجتش ع سويني ود أنا بائس فشخ حرفي,negative
4406,هو زمالك خسر كام,neutral
4407,حب ياسطي رب,positive
4408,رانا سماح ياقلبنا ما تغبيش عن أن سرقة قلب كل رناسماحهفيإنتحر,positive
4409,مش سامع صوت عنى,negative
4410,من قد وسط رياضي روح استقيل,negative
4411,انتي كمان الله يابسبوسه,positive
4412,رفيق سوء مثل بعوض لا أحس ب إلا بعد لسع مصطفى المنفلوطي,negative
4413,الان بدا ان حق نسيتني الم عد اهتم امر ما كان علي ان احبك كثير,negative
4414,دي تتعافي خالص,positive
4415,أما لو أن نزع جلد منوجهي لتنتعليه فانتعليه لا تحرميني ذلك شرف ذيما زال منذ وعي طمع في فواز لعب,positive
4416,اتناك,negative
4417,ال متروقين اربع امبارح ل عين يتكلمو مناسب أي عاوز أفهم,negative
4418,اح يا دوري,negative
4419,قال شيخ ابنباز إذا صلى خطيب ثني خطبة جمع علي رسول على صلاه سلام فليصل مستمع علي رسول لكن في نفس لا رفع ب صوت,neutral
4420,يا ديني ظابط و عمل فولو,negative
4421,أوف أنا عكي دنيا في بعض,negative
4422,عندابن ماج قال ما من جرع أعظم أجر عند الله من جرع غيظ كظم عبد ابتغاء وجه الله مقابل سيئه أسمي كظم من أجل الله,neutral
4423,رانا سماح عنوان فن هي لدى موهب شامل رناسماحهفيإنتحر,positive
4424,يارب طارق عشري درب أهلي,positive
4425,انتي ملكيش عاز,negative
4426,أنا قلب على على قلب,positive
4427,دوبني دوب يا هوي,positive
4428,أنا مش فاهم حاج من الله بقولو بس متحمس مبسوط اغنيه دعاء سباعي,positive
4429,في آخر خسر سبب حكم أحمد سمير غطى أول بلنت تاني باتشيكو لي مجمد معروف حفني جنب,negative
4430,دا في ف مخ اهبل ههههههههههه,negative
4431,ملخص حياه من اتبع هداي لا ضل لا يشقي من اعرض عن ذكر إن ل معيش ضنك,neutral
4432,عنى اسم مزقش لطف بعد ما كوره وقع من,neutral
4433,اي خدم أنت بس تؤمري,positive
4434,كيف سبيل إلى وصال دل,positive
4435,ما بقاش غير إبراهيم سعيد كمان,negative
4436,أصل صاحب تويتر يصحي متاخر شوي,negative
4437,ست شاطره جوز ما يلعبش ف شجر حد غير,positive
4438,مشكله ليس يمن يخذلك خان يوجعك يسحقك مشكله هي أن تمكن من تصديق شخص نال من مر منح فرصة نيل من أخرى,negative
4439,في أي خايف قال أنا مش هقول كل لي حاس أنا بك,negative
4440,مساء خير شارك ف هشتاج ازاينساعدكيامصر,neutral
4441,اتفرجوا علي ماتش أول اتكلموا مش اي زيط تكلم في,negative
4442,أنجز بقي يارب محمد يارب,positive
4443,فعل أنت محق إحساس صعب جد مؤلم,negative
4444,انجي موتتني ضحك جد,positive
4445,تاج ده بتاع النهارده اوب بقي مصر اهمايموشنموجب ايموشنموجب ايموشنموجب ايموشنموجب ايموشنموجب دعاء سباعي دعاء سباعي,positive
4446,مصحف كامل أحمدالعجمي,neutral
4447,لميس حديدي لو كان عايش أيام فرعنه كان هتبقي اله تعريص لميسابليس,negative
4448,اهبل انتبتلعب في عداد عمر يا عبهادي بس أنا رد منور,negative
4449,طب انتي شايف اي حاج غلط حصل في,neutral
4450,رغبة قلب بين يد يا الله,positive
4451,فكر ان هصلح عجله و أنزل بك في اجازه مع صاحب مسيطر علي من صبح و فرحان كأن عيد بكره واحد اتهبل الله,positive
4452,الله خلتوني اعيط اتنطط من فرح اصرخ حسي إن تلاته اخدتو لقب حمدلله هايرجعو لقب,positive
4453,عن فرحة لي متتوصفش ياناس يارب احمد يارب مبروك شاهين حي مصر ولد,positive
4454,مبروك لينا يا شاهين كفاي فرح كنز معنى ليث إسماعيل علوش ريتا جد كل تستاهل كل خير ماعاد حيوان انفصام كرومبه لي معا,positive
4455,يا ابن انتو هو زمالك مين انبي مين لس فاضل ماتش دوري بتاع يا خروف من لي اهلي,negative
4456,اصيل ي انشراحايموشنموجب,positive
4457,مبروك طيب قلب شفة حياة شاهينو تستاهل ياعسل الله رب حمى يارب,positive
4458,يوم عيد ميلاد مبدع عظيم صلاح جاه الله رحم,positive
4459,مبروك محمد شاهين,positive
4460,و أنت خير يا كبير,positive
4461,لا اله الا أنت سبحان ان كان من ظالم,neutral
4462,مش عرف أعمل ريبورت بلوك بس,negative
4463,أنا لي مين غير هعيش لم غير,positive
4464,و قربة حي,positive
4465,مبررررررررروك رنوشتي يستاهل ابن مصررررررر ولي رانا سماح,positive
4466,هههههههههههههههههه حمد الله اتحلت,positive
4467,أحب أقول ل اتش ان لقي فرح بتع سودان طه سليمان,positive
4468,بيجيبو كلام نفس,negative
4469,ما أهلي تغلب امبارح ناس شمت زمالك تغلب نهرده ناس شمت أبقى لس مصر مفيهاش روح رياضي,negative
4470,قطر زف ردو متتخيرش عن,negative
4471,صدقني فاهم واثق ان سيسي ميفرطش في رام مصر أبد,positive
4472,شاف فتى احلامي في لاتينو دا تاون,positive
4473,أكثر استفادة من ماد رياضية ان سالب بعد سالب أعطى موجب عقل راقيه,positive
4474,أنا اشتقتلك اوي الله وحشتيني جد,positive
4475,ان كان شجع زمالك دي حاج ف حد ذات شيء إيجابي أن هتبقي ضامن ان داخل جنه زمالك متعود ع خساره و مرتضيمنصور مبيبطلش شتايم,negative
4476,خليك قاعد لا أنسى لي ما راح تنسيك ان ما في إشي تسوي,negative
4477,ههههههههههههههههههههههههههههههههههههههههههه,positive
4478,أنت علي موبيل لا كمبيوتر,neutral
4479,أصل ليث ده مصررررررري ليث أبو جود,neutral
4480,كما أدان دانى كلمهللزملكاويه,negative
4481,اه أنكر صوت احلي ما شاء الله محبوب معظم فانز طالب كان معا وكل بيصوتله,positive
4482,جاريدومشمدربدهبتاعبطيخ فضحتنا لي شمت في زملكاويه لي هما أصل متعود ع خساره لي كدا ياخي دي عمر ماحصلت,negative
4483,مش عارف أقول غير رب موجود,negative
4484,مبروك شاهينو سن مصر أخير,positive
4485,معني حقيقي كلم كريسماس,neutral
4486,طيب حد يجي يشلني من فيديو رانا هي بتزغرط ده أي يا جدعان حلاوه دي كواته دي يخربيتك عيد مرة مش زهق,positive
4487,مهرجان القم و إسلام أنا نسخ شعبي,neutral
4488,وان نورتيني,positive
4489,هلأ عنجد مفروض انو هي احلي أيام حياة لا عنجد عنجد طيب,negative
4490,اعتقد لو كتب ف بايو هطلع فن ف جو ده أكيد,neutral
4491,لا ثواني كد عشان أفهم أي هي لي جميل زي هندس أنت قصد خصص ديكور,neutral
4492,لمالبم من يوم جول ال أنت رشقتوا في أنت عمل حرقان غير عادي,negative
4493,لو أنت فاكر يا يونس سيلفيا زي قص بتاع زمان سيلفيا عاد,neutral
4494,سن سعيد على يا يونس علي مصر كل يارب رب حمى كل حفظ مصر يارب حقق حلم يارب خير سعاد,positive
4495,مجرد تفكير ف أن اصحي وملاقيش في حياة أبقى اتح علي إعدام جد رب يديكي طول عمر,positive
4496,مينا عطا احساس جامد,positive
4497,على سلام صباح نور,positive
4498,في فرق بين إن اتفشخت وإتغلبت إن إتظلمت وإتغلبت زمالك باصيلعفيفي,negative
4499,يا ناس يا أوفر فطر مش كد رب,negative
4500,هفرح ابتسم مهما أشتد بي بلاء هو زاد,positive
4501,مينا عطا ممكن حد يجبلي رابط اي حساب نزل صورة طالب هما سهر اني عاوز اشوف مينا,neutral
4502,طب نسكافيه اوعي كان نسي فكري عمتو عصير يوستفندي لي فضل سر مابيناز,neutral
4503,راح فين فيكي,positive
4504,أنا و إن مين ضيع حب ايدي,negative
4505,دا أي حزن دا,negative
4506,اسكندراني اهلاوي افتخر مبروك اتحاد سيد بلد ظل أوفياء نادي نادي أهلي,positive
4507,سبحان اللهم حمد شهد أن لا إله إلا أنت استغفر تاب إلى,positive
4508,عشان محدش يزعل علي حلوه مره معا اهليفيالقلب,positive
4509,كل عام أهل محروسه خير عام أفضل مشرق إنشأاللهمصر أم دنيا,positive
4510,ناس مكنتش توقع ان ممكن وقف جنب مكنتش توقع ان ممكن كان قريب من مكنتش توقع ان ممكن دخل حياة في اساس,positive
4511,نظر في قلب راوند,positive
4512,شناوي رجع ماتش جي بقي كفاي قال أدب,negative
4513,أنت عارف ولاد وسخه لي مش بيموتوا عشان وسخه ولاد,negative
4514,أنا لو رئيس زمالك عارف اد أي قيمة منصب ده كان هعرف ان مينفعش بعد كل ماتش اتكلم شعوذ سحر اشتم ناس أنا عند سن,negative
4515,إن لي مبتردش ع موبايل كان سايلنت و لي عامل سايلنت عشان ما اتصل أقولك إن مردتش عشان كان سايلنت,negative
4516,كل ما هو ات ماهو موجود أمر الله,positive
4517,بس تخيل فرق كان في نني رزق اسم علي محمد صلاح مع بعض تقريب محمود عزت كمان بس هاجم رضى وشى,positive
4518,جزى الله خير,positive
4519,يارتني ما فتح واتس جو عشق ممنوع مفيش مرعا لاحساسك لا حب,negative
4520,حب احزان و توهه إنسان و يأس وطن,negative
4521,ممكن الين يتنشر عاوز نتفرج على حفله دي,neutral
4522,ما تحكيش حاج حد هتا لو كان اوريب من عشان هيرو حكى لال اوريب منو مجرب,negative
4523,ردو تجبلي سير مزاكره أنت حمار يا عبدو أنت حمار يسطي لا أي سك علي حوار طلب دلوقتي فتح مش معنى,negative
4524,حب فوق حب تحت,neutral
4525,نسوان ع نسوان فقر طول عمر,negative
4526,أنا عاوز أنجح من غير مذاكر ممكن رسالهاليالسيسي,neutral
4527,كل لغة عالم حب و الله عالم ايموشنموجب,positive
4528,كان عند مدرس ضرب جلد حمير واح كان قعد نيناونوله صوت قط عنى ف فصل نروش بس كان افترى على صراحه,negative
4529,مبروك يا ابن مصر محمدشاهين,positive
4530,ماهو أنا بطل بس لي شيل تعبني نيك,negative
4531,أسعد روح يا جاكيت,positive
4532,مانول جوزيه قال كل حاج باتشيكو في دوري مصري الا انو ما حكم كان غبي و معر مفروض يقلعله هدوم باصيلعفيفي,negative
4533,اه الي كيف مجوز توا أنت مش مزال أقر,neutral
4534,علي فرح مينا شيرين اخو شاهين هما دولة ولاد بلد هي دي مصرررررر تحيامصر مينافخرالعرب,positive
4535,افراد لان متعود علي اشتباك مع أمن ودي كان جرب مفيد فاد في ثوره انتصار قومي بقي,positive
4536,دا كلام نجم محمد حماقي عن مينا كوليس برايم واضح ان حماقي ال عجب ركز معا هو مينا عطا,positive
4537,لا مش كل اولتراس شاب جامعي أنا كان معايا عربجي حرفي,negative
4538,و من حيث لا درى كدا أبقى مخنوق دا أكيد سبب ان أنت عبي شل جو كتير حد ما مبقاش في حيز يساع اكتر من كدا,negative
4539,طب أنا جد عاوز اروح مش عارف تعبان نيك مش هقدر اسوق حد يجي يروحني يا جدعان,negative
4540,شهو جوع تغلب حين ع شهوه جنسيه,neutral
4541,ممكن كان اكتر حاج بسطة فرحان بك كان هي مصدر تعاسة في حياه عكس صحيح قدر غيب,neutral
4542,ما عنى كان شاف نفس يا ديحو بعد هشام أكبر من ب سنة عنى قدام شوي مات أنت لس شاب,neutral
4543,أنا سقط,negative
4544,عنى كانو ضد ثوره نجحو اخوان,neutral
4545,حسب الله نعم وكيل دولة كلب معندهمش لا دين لا عقل و شامت ل يوم الله ف جنه يا شهيد واجب وطني,negative
4546,عيز فيديو بليز,neutral
4547,باي ذو واي أنا مل من سياسه كمان ماتش فاضل أي كد نهر في,negative
4548,مال بقي وحش عنى,negative
4549,قول احبك كي زاد وسام ف غير حب لا أكون وسيم,positive
4550,كل لي يوم فرحة معا بيعذبني,negative
4551,صاحب دل زي كلوت لا من ستر لا من يدفي,negative
4552,تواضروس حريه زائده مضر وجب تشديد رقابه علي إنترنت مش ناقص كمان غير ان طلب محكمة تفتيش بتاع عصر وسطي,negative
4553,غبي,negative
4554,أنا امتي نسي لا عشان أنا مش تكلم,negative
4555,كافر قريش دولة كانو ود وسخ جاحد اوي بقي نبي عرض على تدخلو اسم تدخلو جنه رفض كانو هيخسروا أي عنى مش أحسن من اصنام,negative
4556,وطن فيديو شريف مدكور هعرض ثواني من أغنى كريسماس عشان باقي عيب,neutral
4557,الله أنا غير جد علي أخت مش عارف لي,positive
4558,ايوه مش ده لي قنا شرق جاب ده عند في صديق علي إلفيس اعرف,neutral
4559,خوف لي يخليك مش عارف فرح دا من اسخف حاجة ف دنيا,negative
4560,زغروطه رانا سماح عقب فوز شاهين لقب ستار أكاديمي زغروطه رانا سماح,neutral
4561,ملعون آبو آحتياج,negative
4562,أي علي إلفيس بوك ياكابتن أنت حالي لعب في نادي أي,neutral
4563,عرف علي هاتف ذكي قم تنزيل يوم من,neutral
4564,أنا عيز اتعرف عليكي,positive
4565,كفن ملوش جيب يتحط في فلس,negative
4566,امتحاني بكره بس كد,neutral
4567,كل عام حب أجمل يا مضوي شمع سنة كل عام أنت أول في حياة قلب عين,positive
4568,شغل بيض اح نيك يا نادي معرض ملي,negative
4569,موقع تعليمي طفل,neutral
4570,و يوم ما حب حب من ضحكة ايموشنموجب,positive
4571,يوم كل حمام,positive
4572,واهي خلص حكايه خير افتكر,positive
4573,كاستيلو منتزه بق خر نيك,negative
4574,أهم شئ طاعه,positive
4575,ايوه بقي يا مينو حش مينافخرالعرب,positive
4576,عشري جون زمالك أول جول أحمد الله لان لم احتسب كاد أنا غير ناتيجه اح نعملكوا أي تاني يا ولاد مره عوز حكم من صين حكم مع,negative
4577,ازاي أسماء,neutral
4578,علمتنيالحياه أن الذي عاش علي أرض ليس ملائك بل بشر قد أصاب قد أخطأ لا جاز أن أحكم علي شخص من موقف واحد تعامل مع في,positive
4579,ميريكرسمس كل سن أنتم طيب,positive
4580,و انتهى مشوار خواجه,negative
4581,مش عارف ابتدي مذاكر من,negative
4582,إختصر طريق بدل من إختيار منصف ثم انقلاب على بدا أن دولة عميقه ضارب جذر في دولة عالم نامي كل,negative
4583,إذ خان مرأه هي بحث عن إهتمام و إذ خان رجل هو بحث عن عاهر,negative
4584,يا حبيب بعد نار قلب داب من انتظار,positive
4585,يا سامح الله من علم أن كان خيب,negative
4586,خي مال قفل من كل حت كد لي,negative
4587,ناس لي حضر حفلة برلمان قديم ياريت ما يحضروش حفله لي جايه خاص ان مفيهاش رقص مره دي,negative
4588,رب حمى انت زكريا بس تعال هنا مش تباركلي,positive
4589,أما نظم عداله إجتماعيه بعث علي إطمئنان فضيل عنى كل مشكلة موجود الان لم كان موجود يوم ناصر,positive
4590,هذا دنيا كتاب أنت في فكر ده كلام أغنى رومانسي م كلثوم و ده دليل عل إن دلوقتي عائش في لاع مجرى فكري كبير و الله,negative
4591,و تشجيني معنى و اردد و اغني و أنا سهران و يجي نوم يناديني اقي شوق يصحيني علي حرمان,positive
4592,شكر يادكتور,positive
4593,عنلأبوأم جنتله يا عم,negative
4594,اح محدش يعله علينابس كد وصلتشكرا,negative
4595,فعل يا عفيف أنت ديما أنسى هم قرف فيديو أجاب من آخر باصيلعفيفي,positive
4596,لا ده اسم علي اسم غالي اسم أحمد,positive
4597,ها أي راي قال أي بق أنا قول مودي حلو,positive
4598,لأ ابن صرمه دا لس في فيلدز بس حاج لاع خالص,negative
4599,م أنا هفضل ابن سفينة حتي و لو شربتو بحر,positive
4600,اي عنى راح متجيش اي عنى هوى مفيش,negative
4601,نفس كد في فلورز كتير حربالفولورزبرعايهسيزاروترمسافندي,positive
4602,أنت اخوي كبير و اخوي دم ياعم,positive
4603,حين مات لا حزن إن مجرد وقت تنسوني كما نسيتوني أنا حي,negative
4604,عند تذكر مؤمن أن أمر كل الله أن حياة جرى على قدر الله اختيار ل حتم اطمأن قلب,positive
4605,نظام لي مرتضى منصور ماشي ب ده ان مشى مدرب بعد كل ماتش هيخسره هيودينا في داهي في آخر زمالك هينافس أهلي عل مركز سابع,negative
4606,دعاء سباعي دودو بس,positive
4607,أنا نهي نفرة قهوه اديرو,neutral
4608,هههههههههههههههههه,positive
4609,سوني لا سوني أفضل بلاش فتى,neutral
4610,أهم حاج بورتلاندي أصل لمؤغذه عمود من دولة لازم أبقى متين,positive
4611,موت آخر نقطة ندم جوايا من ناحية,negative
4612,ما اعتبر حد عائش ان مات دي أبقى اصعي من موت,negative
4613,ومكملينالمشوار مين عاوز سمع رايديو رانا,neutral
4614,بس حق يتقال مسلسل شيخ صراح,positive
4615,ههههههه ماشي خق,positive
4616,فقد في أمل مفيش من رجا رمى طوبة من زمان,negative
4617,عليربيع جامد مالوش حل,positive
4618,سأل حسن بصري رحم الله أين وجد راحه قال سجد بعد غفل توب بعد ذنب,neutral
4619,رسم حلم و عاش يوم و غني هوي نغم,positive
4620,ليل ليل عمر ايموشنموجب ايموشنموجب,positive
4621,الله أخرب بيت يامرسي,negative
4622,حضرة ألف صح خير كل يوم فرح,positive
4623,لوسانتاكلوزمصري هيتثبت ليل,negative
4624,هبتدي انام بدر بقي اقوم بدر عشان اذاكر حوار دي خر مش تيجي معايا سك,negative
4625,أنا باجي علي وقت ده و بقي عامل كد سوري آم نوى سوري,negative
4626,أكيد طبع شرف ل يا خدم زوبر,negative
4627,أمكن رجوله صعب على بس مو ضروري صار نثيه,negative
4628,من أجمل أيام حياة جد كتبكتابي علي حبيب,positive
4629,أخاطب شيب افاني علي صغر عجل أم عادني هم علي عجل هذا بياض الذي في مفرق لغ قرأ في فصل يأس أملأحدثالليل,negative
4630,مش حوار هسقطه,negative
4631,أنت اعلم يا الله,positive
4632,لي يطنش يطنش بكره يتطنش,negative
4633,أنا عرف في ديمسبر ياسوكا هنهي معا في ديسمبر,negative
4634,كل سن أنت طيب ياصاحبي عقبال سن يارب سن سعيد على تحقق في كل احلام ايموشنموجب,positive
4635,أنا لي اصحي ساعه صبح عشان أنزل درس لي هه,negative
4636,ههههههههههههه سعيدالهوا,positive
4637,حمد الله علي علامة سريع قاطع شافيه,positive
4638,و أي مشكله و اح بلد فشل في زويل نجح في صافيناز,negative
